,product_id,name,NoOfReviews
0,1,Pink Friday: Roman Reloaded Re-Up (w/dvd),1
1,2,Lundberg Organic Cinnamon Toast Rice Cakes,2
2,3,K-Y Love Sensuality Pleasure Gel,27
3,4,"J.R. Watkins Hand Cream, Lemon Cream",6
4,5,Ambi Complexion Cleansing Bar,4
5,6,"Johnson's Baby Bubble Bath and Wash, 15oz",14
6,7,Olay Regenerist Deep Hydration Regenerating Cream,634
7,8,Windex Original Glass Cleaner Refill 67.6oz (2 Liter),346
8,9,"Heinz Tomato Ketchup, 38oz",1
9,10,Kind Dark Chocolate Chunk Gluten Free Granola Bars - 5 Count,17
10,11,"Pantene Color Preserve Volume Shampoo, 25.4oz",18
11,12,"Aussie Aussome Volume Shampoo, 13.5 Oz",89
12,13,Cars Toon: Mater's Tall Tales,34
13,14,CeraVe SA Renewing Cream,25
14,15,Solo Foods Almond Paste,5
15,16,"Finish Quantum Dishwasher Detergent, Lemon Sparkle Scent, 45 Count",35
16,17,Disney174 Jake And The Neverland Pirates 4 Piece Bedding Set - Toddler,1
17,18,Pearhead Id Bracelet Frame,1
18,19,Craft Punch Giga Scallop Circle 45 24687534 To 334,1
19,20,"Neutrogena Wet Skin Sunscreen Spray Broad Spectrum SPF 50, 5oz",13
20,21,Meguiar's Deep Crystal Car Wash 64-Oz.,19
21,22,"Banana Boat Sunless Summer Color Self Tanning Lotion, Light To Medium",72
22,23,"Cetaphil Gentle Skin Cleanser, 2oz",7
23,24,"Suave Professionals Hair Conditioner, Sleek",50
24,25,Bumble Bee Solid White Albacore In Water - 5 Oz,9
25,26,Citrus Magic Instant Spot & Stain Remover,1
26,27,La Tortilla Factory Hand Made Style Tortillas Flour,1
27,28,Black Sister's Revenge (dvd),1
28,29,Sea Gull Lighting Six Light Bath Sconce/vanity - Brushed Nickel,3
29,30,"The Seaweed Bath Co. Argan Conditioner, Smoothing Citrus",9
30,31,"Way Basics 3-Shelf Eco Narrow Bookcase Storage Shelf, Espresso - Formaldehyde Free - Lifetime Guarantee",10
31,32,Bi-O-kleen Spray & Wipe All Purpose Cleaner,8
32,33,Yes To Carrots Nourishing Body Wash,63
33,34,Alberto VO5 Salon Series Smooth Plus Sleek Shampoo,2
34,35,Dark Shadows (includes Digital Copy) (ultraviolet) (dvdvideo),245
35,36,Clambake (dvd),2
36,37,Mike Dave Need Wedding Dates (dvd + Digital),746
37,38,Sea Gull Lighting Ceiling Fan - White,1
38,39,Progresso Traditional Meatball & Rice Soup,1
39,40,Herr's Baked Cheese Curls,1
40,41,Hawaiian Punch Berry Limeade Blast Juice,19
41,42,Moom Express Pre Waxed Strips For Face & Bikini,4
42,43,My Big Fat Greek Wedding 2 (blu-Ray + Dvd + Digital),657
43,44,King Ralph (dvd),2
44,45,Holmes174 Personal Indoor Heater W/ Manual Controls White 1500w Hfh131-N,31
45,46,The Script - No Sound Without Silence (cd),39
46,47,"Beanitos Bean Chips, Simply Pinto Bean",3
47,48,Pantene Pro-V Expert Collection Age Defy Conditioner,136
48,49,Greyson Vintage Industrial Occasional Cocktail Coffee Table - Antique Bronze - Baxton Studio,1
49,50,Nature's Path Flax Plus Maple Pecan Crunch Cereal,3
50,51,Lite Source Basic Ii 1-Lt Floor Lamp - Dark Bronze,1
51,52,"Sloan Royal Urinal Flush Valve, 1.0 Gpf, Royal 186-1",1
52,53,Sunflower Swag With Metal Frame - Nearly Natural,1
53,54,Toy Story Kids' Woody Accessory Kit,3
54,55,Maranatha No Stir Raw Maple Almond Butter,16
55,56,Chex Muddy Buddies Brownie Supreme Snack Mix,24
56,57,Sopranos:Season 6 Part 1 (blu-Ray),68
57,58,Tresemme Kertatin Smooth Infusing Conditioning,56
58,59,Wagan Smartac 80watt Inverter With Usb,5
59,60,"Creme Of Nature Intensive Conditioning Treatment, 32",12
60,61,Arrid Extra Dry Anti-Perspirant Deodorant Spray Regular,18
61,62,Eagle Fat Free Sweetened Condensed Milk,13
62,63,"Pinaud Clubman Styling Gel, Superhold",6
63,64,Wedding Wishes Wedding Guest Book,1
64,65,Diet Canada Dry Ginger Ale - 12pk/12 Fl Oz Cans,43
65,66,Baxter Of California Cream Pomade,6
66,67,Ragu Roasted Garlic Parmesan Pasta Sauce,20
67,68,Sabre 2 Pack Door And Window Alarm,13
68,69,"Pendaflex174 Divide It Up File Folder, Multi Section, Letter, Assorted, 12/pack",310
69,70,"Newman's Own Organics Licorice Twist, Black 5oz",4
70,71,The Honest Company Laundry Detergent,20
71,72,Plano Mini-Magnum 13-Compartment Tackle Box,3
72,73,Hoover174 Platinum Collection153 Lightweight Bagged Upright Vacuum With Canister - Uh30010com,348
73,74,Stander Pt Bedcane - Bed Handle,11
74,75,Calvin Klein Secret Obsession Eau De Parfum,1
75,76,"Wallmount Server Cabinet (450mm, 9 RU)",1
76,77,Happy Tot Apple and Butternut Squash,9
77,78,Udi's Pepperoni Pizza,1
78,79,"Better Built 74010862 Bet74010862 60In Crossover Two Lid, Deep, Truck Tool Box",10
79,80,The Resident Evil Collection 5 Discs (blu-Ray),843
80,81,Annie's Homegrown Gluten Free Double Chocolate Chip Granola Bars,7
81,82,"Super Poligrip Denture Adhesive Cream, Ultra Fresh - 2.4 Oz",20
82,83,Nearly Natural 5.5' Bamboo W/decorative Planter,6
83,84,100:Complete First Season (blu-Ray),138
84,85,"Australian Gold Exotic Blend Lotion, SPF 4",34
85,86,"Colorganics Lipstick, Cayenne",4
86,87,Germ Guardian174 Elite 3-In-1 Pet Pure True Hepa Air Purifier Ac4300bptca,1
87,88,Red (special Edition) (dvdvideo),667
88,89,"Hormel Chili, No Beans",171
89,90,Tai Pei Sweet & Sour Chicken,19
90,91,Clorox Disinfecting Wipes Value Pack Scented 150 Ct Total,8517
91,92,"Avery174 Ready Index Contemporary Table Of Contents Divider, 1-8, Multi, Letter",299
92,93,Chips Deluxe Soft 'n Chewy Cookies,3
93,94,"WeatherTech 40647 14-15 Outlander Cargo Liners Behind 2nd Row, Black",11
94,95,Orajel Maximum Strength Toothache Pain Relief Liquid,46
95,96,Chester's Cheese Flavored Puffcorn Snacks,165
96,97,D-Con Mice Bait Station - 3ct,6
97,98,"Lysol Concentrate Deodorizing Cleaner, Original Scent",152
98,99,Coola Organic Sunscreen Classic Face Cucumber SPF 30,2
99,100,"Burt's Bees Lip Shimmer, Raisin",871
100,101,SC Johnson One Step No Buff Wax,8
101,102,"Simple Green All-Purpose Cleaner, 16oz",4
102,103,Wilton Black Dots Standard Baking Cups,1
103,104,Mrs. Meyer's174 Lemon Verbena Laundry Scent Booster - 18oz,29
104,105,Cuisinart174 Electric Juicer - Stainless Steel Cje-1000,102
105,106,Avery174 11-1/4 X 9-1/4 Index Maker Extra Wide Label Dividers With 5 Tab - Clear (5 Sets Per Pack),1
106,107,"Iman Second To None Stick Foundation, Clay 1",15
107,108,Romantic Drama: Greatest Classic Films Collection 2 Discs,3
108,109,"Lundberg Wehani Rice, 25lb",406
109,110,Post Bound Jumbo Album - Burgundy (11x14),8
110,111,Stonyfield Yobaby Peach & Pear Yogurt 4oz 6 Ct,1
111,112,Charcoal Stone Toothbrush Holder Gray,2
112,113,"Bounce Dryer Sheets, Fresh Linen, 160 sheets",84
113,114,"L'oreal Paris Visible Lift Smooth Absolute, Natural Buff",22
114,115,"Just For Men Touch Of Gray Gray Hair Treatment, Black T-55",222
115,116,Roommates No Place Like Home Peel Stick Wall Decals,1
116,117,Pocket Watch Wall Clock Distressed Black - Yosemite Home Decor174,1
117,118,Kraus FVS-1007 Single Hole Vessel Bathroom Faucet from the Ramus Collection,37
118,119,Mill Creek Aloe Vera & Paba Lotion,9
119,120,"All,bran Complete Wheat Flakes, 18 Oz.",11
120,121,Clorox Ultimate Care Premium Bleach,1
121,122,Kind Nut Delight Bar,3
122,123,"Coty Airspun Face Powder, Translucent Extra Coverage",154
123,124,Nature's Path Chunky Chocolate Peanut Chewy Granola Bars,2
124,125,Axe Dry Anti-Perspirant Deodorant Invisible Solid Phoenix,58
125,126,Power Crunch Protein Energy Bar Peanut Butter Creme Original,39
126,127,"42 Dual Drop Leaf Table with 2 Madrid Chairs""",1
127,128,"Smead174 Recycled Letter Size Manila File Backs W/prong Fasteners, 2 Capacity, 100/box",2
128,129,Nearly Natural Pothos Ledge Plant (set On Foam) Silk Plant,2
129,130,Little Bedding By Nojo Jungle Dreams 2 Pack Sheet Set,8
130,131,Sizzix Framelits Dies 1by Tim Holtz Bird Crazy-Silver Asst Sizes,16
131,132,Vaseline Intensive Care Lip Therapy Cocoa Butter,158
132,133,Tostitos Simply Blue Corn Tortilla Chips,21
133,134,Starbucks153 Doubleshot Protein Coffee - 11 Fl Oz,2
134,135,Bill Glor Gaither - Church In The Wildwood (cd),3
135,136,"RC Cola, 12oz",2
136,137,There's Something About Mary (dvd),126
137,138,Head & Shoulders Dandruff Shampoo Ocean Lift 2 In 1,6
138,139,Elvis Presley - Girl Happy (cd),1
139,140,Kenroy Home Table Lamp - Chrome,1
140,141,Black Front Loading Frame Set (8.5x11) Set Of 12,9
141,142,"Dermalogica Special Cleansing Gel, 8.4oz",4
142,143,"L'oreal Paris Colour Caresse Wet Shine Stain, Pink Resistance",45
143,144,Doc Mcstuffins: Friendship Is The Best Medicine,22
144,145,"Smead174 3-In-1 Supertab Section Folders, 1/3 Cut Top Tab, Letter, Assorted, 12/pack",2
145,146,Bilbao Nightstand Gray Oak - South Shore,6
146,147,Africa's Best No-Lye Dual Conditioning Relaxer System Super,6
147,148,Tramontina Ceramica 10 Piece Cookware Set - Red,3
148,149,"Newman's Own Balsamic Vinaigrette, 16.0oz",8
149,150,"Carson-Dellosa Publishing Photographic Learning Cards Boxed Set, Nouns/verbs/adjectives, Grades K-12",1
150,151,Home Health Hairever Shampoo,1
151,152,Lite Source Reiko 1 Light Table Lamp - Orange,1
152,153,Sea Gull Lighting One Light Wall/bath/vanity-Brushed Nickel,1
153,154,J.a. Henckels International 4-Pc Everedge Plus Steak Knife Set,9
154,155,Olay Moisturizing Lotion For Sensitive Skin,3
155,156,"Kikkoman Soy Sauce, 5fl oz",5
156,157,Kohler 10280-4 Fort Bath Spout With Sculpted Lift Rod and 1/2-in NPT Connection,8
157,158,Naturtint Nutrideep Multiplier Protective Cream,5
158,159,Gain Original Scent Liquid Fabric Softener 129 Oz,6
159,160,"Burt's Bees Lip Shimmer, Watermelon",5
160,161,Pleasant Hearth Diamond Fireplace Screen - Espresso,31
161,162,Scooby Doo And The Loch Ness Monster (blu-Ray),2
162,163,Cal Lighting Led Dark Bronze Finish Metal Piano Lamp,1
163,164,Lynk Professional174 Pull Out Cutting Board Bakeware Sliding Cabinet Organizer,3
164,165,Trend Lab Park Nursing Cover - Paisley,11
165,166,L'oreal Paris Advanced Hairstyle Boost It High Lift Creation Spray,33
166,167,Plum Organics Just Prunes,2
167,168,"Batherapy Natural Mineral Bath Sport Liquid, 16 oz",2
168,169,"Candy Pink Plastic Cups, 20 pk",1
169,170,Various - Country's Greatest Gospel:Gold Ed (cd),1
170,171,JNH Lifestyles Goldstar 3 Person FAR Infrared Sauna,1
171,172,Soothing Touch Lemon Cardamom Vegan Lip Balm .25 Oz,6
172,173,"2x Ultra Era with Oxi Booster, 50fl oz",5
173,174,Every Man Jack Pomade Signature Mint Scent,1
174,175,Reebok Classic Leather Running Shoes - White (Men),5
175,176,Annie's Homegrown Deluxe Elbows & Four Cheese Sauce,2
176,177,Delta Single Handle Shower Faucet,24
177,178,"Ogx Conditioner, Hydrating Teatree Mint",22
178,179,"Physicians Formula Mineral Wear Talc-Free Mineral Correcting Powder, Creamy Natural",10
179,180,Equals (blu-Ray),13
180,181,Weleda Everon Lip Balm,8
181,182,Fiskars174 Classic Stick Rotary Cutter (45 Mm),5
182,183,Clorox Disinfecting Bathroom Cleaner,2030
183,184,"BRIDGESTONE 130/70ZR18M/C(63W)FRONT EXEDRA G851, CRUISER RADL",9
184,185,Metzeler ME888 Marathon Ultra Custom Touring Front Tire 100/90-19,10
185,186,Fantasy Fields Lil' Sports Fan Step Stool - Teamson,1
186,187,Starbucks Iced Expresso Classics Vanilla Latte Coffee Beverage - 40oz,3
187,188,Head & Shoulders Classic Clean Conditioner,85
188,189,Blue Anchor Design Throw Pillow (18x18) - Rizzy Home,1
189,190,Kendall Comforter And Sheet Set (twin) Aqua - 7pc,6
190,191,"Tree Hut Shea Body Butters, Coconut Lime, 7 oz",28
191,192,Cococare 100% Natural Castor Oil,3
192,193,Pacific Natural Foods Organic Beef Broth,1
193,194,Honeywell Heatbud Ceramic Heater Black,9
194,195,"Jergens Extra Moisturizing Liquid Hand Wash, 7.5oz",9
195,196,Lay's Salt & Vinegar Flavored Potato Chips,6
196,197,Noosa Honey Yogurt,1
197,198,0.6 Cu. Ft. Letter A4 Size Waterproof 30 Min. Fire File Chest,6
198,199,If A Man Answers (dvd),4
199,200,"Pleasant Hearth 1,800 sq ft Wood Burning Stove with Blower, Medium, LWS-127201",53
200,201,Stacy's Simply Naked Bagel Chips,23
201,202,Stacy's Garden Veggie Medley Pita Chips,2
202,203,Tostitos Bite Size Tortilla Chips,233
203,204,Nexxus Exxtra Gel Style Creation Sculptor,692
204,205,Hollywood Beauty Olive Cholesterol,6
205,206,Southern Enterprises Archer Fold-Away Home Bar in Walnut,1
206,207,Chips Ahoy! Original Chocolate Chip - Cookies - Family Size 18.2oz,61
207,208,4C Grated Parmesan Cheese 100% Natural 8oz Shaker,6
208,209,"Caress Moisturizing Body Bar Natural Silk, 4.75oz",65
209,210,Feit 60-Watt A19 Gu24 Base Led Light Bulb - Soft White,8
210,211,Heiress (dvd),2
211,212,Mia Shower Curtain Green/brown - Lush Decor174,11
212,213,Progresso Traditional Chicken Tuscany Soup,6
213,214,Yes To Grapefruit Rejuvenating Body Wash,39
214,215,Progresso Light Vegetable & Noodle Soup,3
215,216,Maybelline Clean Express! Makeup Removing Lotion,3
216,217,"Physicians Formula Powder Palette Mineral Glow Pearls, Translucent Pearl",7
217,218,"Pleasant Hearth 7.5 Steel Grate, 30 5 Bar - Black",27
218,219,Switchmas (dvd),7
219,220,Vaseline Intensive Care Healthy Hands Stronger Nails,95
220,221,Solo Foods Poppy Seed Cake and Pastry Filling,8
221,222,Alex Cross (dvdvideo),141
222,223,Clear Scalp & Hair Therapy Total Care Nourishing Shampoo,371
223,224,Cheetos Crunchy Flamin' Hot Cheese Flavored Snacks,49
224,225,Bisquick Original Pancake And Baking Mix - 40oz,94
225,226,Olivella Bar Soap - 3.52 Oz,3
226,227,Godzilla 3d Includes Digital Copy Ultraviolet 3d/2d Blu-Ray/dvd,3311
227,228,Voortman Sugar Free Fudge Chocolate Chip Cookies,4
228,229,"Finish Gelpacs Dishwasher Detergent, Orange Scent, 84ct",2
229,230,Tim Holtz Retractable Craft Pick-Red 6x.5,2
230,231,Ragu Traditional Pasta Sauce,33
231,232,Stargate (ws) (ultimate Edition) (director's Cut) (dvdvideo),186
232,233,"Iman Luxury Moisturizing Lipstick, Black Brandy 006",1
233,234,"Aveeno Baby Continuous Protection Lotion Sunscreen with Broad Spectrum SPF 55, 4oz",296
234,235,"Ben & Jerry's Coffee, Coffee Buzzbuzzbuzz! Ice Cream, Pint",11
235,236,Jolly Time Select Premium Yellow Pop Corn,23
236,237,Leslie Sansone:Belly Blasting Walk (dvd),30
237,238,Boraam Sonoma Kitchen Cart With Wire Brush Gray - Maaya Home,27
238,239,Jason Aldean - They Don't Know,196
239,240,Ogx Anti-breakage Keratin Oil 3 Minute Miraculous Recovery,9
240,241,Meguiar's Ultimate Quik Detailer 22-Oz.,29
241,242,Care Free Curl Gold Instant Activator,13
242,243,Spam Single Classic,6
243,244,"Smead174 2 1/4 Inch Accordion Expansion Wallet, Poly, Letter, Translucent Green",2
244,245,Cantu Coconut Milk Shine Hold Mist - 8oz,4
245,246,"Vicks Vaporub, Regular, 3.53oz",92
246,247,Planes: Fire Rescue (2 Discs) (includes Digital Copy) (blu-Ray/dvd),1140
247,248,Various Artists - Choo Choo Soul (cd),28
248,249,High-Dome Floor Door Stop,1
249,250,"Shea Moisture Mango & Carrot Kids Extra-Nourishing Conditioner, 8fl Oz",24
250,251,Ceiling Fan With Light White 14.2 X 29.9 X 9.2 - Hunter Fan,2
251,252,Concept Housewares 36 Natural Wood ceiling mounted pot rack,8
252,253,Tostitos Original Restaurant Style Tortilla Chips,1
253,254,Walkers Stem Ginger Shortbread,1
254,255,Barielle Nail Rebuilding Protein,7
255,256,"Musselman Apple Sauce, Cinnamon, 48oz",6
256,257,"Storkcraft Tuscany Glider and Ottoman, Beige Cushions, Espresso Finish",263
257,258,Queen Helene Cocoa Butter Solid,8
258,259,"Bodycology Nourishing Body Cream, Pretty In Paris",1
259,260,Sea Gull Lighting Holman One Light Wall/bath Sconce - Brushed Nickel,2
260,261,Chobani174 Strawberry On The Bottom Non-Fat Greek Yogurt - 5.3oz,23
261,262,Meguiars Interior Detailer Wipes 25ct,16
262,263,Bedtime Originals Pinkie Musical Mobile,6
263,264,Various - Red Hot Blue:Tribute To Cole Porter (cd),3
264,265,L'oreal Paris Advanced Hairstyle TXT IT Hyper-Fix Putty,23
265,266,2017-2018 Brownline174 Duraflex 14-Month Planner 8 1/2 X 11 Black,4
266,267,Mrs. Meyer's Lemon Verbena Surface Scrub,15
267,268,L'or233al Paris Elvive Extraordinary Clay Rebalancing Conditioner - 12.6 Fl Oz,1186
